{
  "$schema": "./definitions-schema.json",
  "filters": {
    "bike_sharing": [
      "city_bike_linz",
      "nextbike",
      "oebb_bike",
      "regiorad_tirol",
      "stadtrad_innsbruck",
      "radbox",
      "dott_bike"
    ],
    "car_rental": [
      "gourban"
    ],
    "escooters": [
      "dott",
      "bird",
      "tier",
      "lime"
    ],
    "individual": [],
    "nearby": [],
    "public": [],
    "taxi": []
  },
  "redeem_code": {
    "providers": [
      {
        "color": "#FF4082",
        "icon": "icon_wegfinder",
        "id": "wegfinder",
        "translation_key": "code_provider.wegfinder"
      },
      {
        "color": "#9F072D",
        "icon": "icon_stadtrad_innsbruck",
        "id": "stadtrad_innsbruck",
        "translation_key": "code_provider.stadtrad_innsbruck"
      },
      {
        "color": "#000000",
        "icon": "icon_vvt_regiorad",
        "id": "vvt_regiorad",
        "translation_key": "code_provider.vvt_regiorad"
      }
    ],
    "sponsors": [
      {
        "id": "wegfinder",
        "translation_key": "code_sponsor.wegfinder"
      },
      {
        "id": "stadtrad_innsbruck",
        "translation_key": "code_sponsor.stadtrad_innsbruck"
      },
      {
        "id": "vvt_regiorad",
        "translation_key": "code_sponsor.vvt_regiorad"
      },
      {
        "id": "city_bike_linz",
        "translation_key": "code_sponsor.city_bike_linz"
      },
      {
        "id": "nextbike",
        "translation_key": "code_sponsor.nextbike"
      },
      {
        "id": "oebb_bike",
        "translation_key": "code_sponsor.oebb_bike"
      },
      {
        "id": "rail_and_drive",
        "translation_key": "code_sponsor.rail_and_drive"
      },
      {
        "id": "bird",
        "translation_key": "code_sponsor.bird"
      },
      {
        "id": "dott",
        "translation_key": "code_sponsor.dott"
      },
      {
        "id": "dott_bike",
        "translation_key": "code_sponsor.dott"
      },
      {
        "id": "lime",
        "translation_key": "code_sponsor.lime"
      },
      {
        "id": "oebb_transfer",
        "translation_key": "code_sponsor.oebb_transfer"
      },
      {
        "id": "postbus",
        "translation_key": "code_sponsor.postbus"
      },
      {
        "id": "vvt",
        "translation_key": "code_sponsor.vvt"
      },
      {
        "id": "ivb",
        "translation_key": "code_sponsor.ivb"
      },
      {
        "id": "ooevv",
        "translation_key": "code_sponsor.ooevv"
      },
      {
        "id": "baden",
        "translation_key": "code_sponsor.baden"
      },
      {
        "id": "leoben",
        "translation_key": "code_sponsor.leoben"
      },
      {
        "id": "villach",
        "translation_key": "code_sponsor.villach"
      },
      {
        "id": "oebb",
        "translation_key": "code_sponsor.oebb"
      }
    ]
  },
  "transport": [
    {
      "color": "#137FD2",
      "icon": {
        "default": "icon_transport_route_start"
      },
      "id": "route_start",
      "translation_key": "transportation_label.route_start"
    },
    {
      "color": "#FF4082",
      "icon": {
        "default": "icon_transport_route_end"
      },
      "id": "route_end",
      "translation_key": "transportation_label.route_end"
    },
    {
      "color": "#b771ca",
      "icon": {
        "default": "icon_transport_region_bike_sharing"
      },
      "id": "region_bike_sharing",
      "translation_key": "transportation_label.region_bike_sharing"
    },
    {
      "color": "#07d183",
      "icon": {
        "default": "icon_transport_region_escooters"
      },
      "id": "region_escooters",
      "translation_key": "transportation_label.region_escooters"
    },
    {
      "color": "#e20329",
      "icon": {
        "default": "icon_transport_rail_and_drive"
      },
      "id": "region_car_rental",
      "translation_key": "transportation_label.region_car_rental"
    },
    {
      "color": "#ff4082",
      "icon": {
        "default": "icon_transport_unknownstoptype"
      },
      "id": "postbus_station",
      "translation_key": "transportation_label.postbus_station"
    },
    {
      "color": "#e2002a",
      "icon": {
        "default": "icon_transport_train",
        "indicator": "icon_transport_public_indicator",
        "nearby": "icon_transport_train_nearby"
      },
      "id": "train",
      "priority": "primary",
      "translation_key": "transportation_label.train",
      "type": "public"
    },
    {
      "color": "#24c2f9",
      "icon": {
        "default": "icon_transport_bus",
        "indicator": "icon_transport_public_indicator"
      },
      "id": "long_distance_bus",
      "translation_key": "transportation_label.long_distance_bus",
      "type": "public"
    },
    {
      "color": "#00aeef",
      "icon": {
        "default": "icon_transport_s_bahn",
        "indicator": "icon_transport_public_indicator"
      },
      "id": "city_train",
      "translation_key": "transportation_label.city_train",
      "type": "public"
    },
    {
      "color": "#00aeef",
      "icon": {
        "default": "icon_transport_s_bahn",
        "indicator": "icon_transport_public_indicator"
      },
      "id": "s_bahn",
      "priority": "primary",
      "translation_key": "transportation_label.s_bahn",
      "type": "public"
    },
    {
      "color": "#00aeef",
      "icon": {
        "default": "icon_transport_s_bahn",
        "indicator": "icon_transport_public_indicator"
      },
      "id": "sbahn",
      "priority": "primary",
      "translation_key": "transportation_label.sbahn",
      "type": "public"
    },
    {
      "color": "#156ab8",
      "icon": {
        "default": "icon_transport_metro",
        "indicator": "icon_transport_public_indicator"
      },
      "id": "metro",
      "priority": "primary",
      "translation_key": "transportation_label.metro",
      "type": "public"
    },
    {
      "color": "#ee1d23",
      "icon": {
        "default": "icon_transport_metro_u1",
        "indicator": "icon_transport_public_indicator"
      },
      "id": "metro_u1",
      "priority": "primary",
      "translation_key": "transportation_label.metro",
      "type": "public"
    },
    {
      "color": "#9f65aa",
      "icon": {
        "default": "icon_transport_metro_u2",
        "indicator": "icon_transport_public_indicator"
      },
      "id": "metro_u2",
      "priority": "primary",
      "translation_key": "transportation_label.metro",
      "type": "public"
    },
    {
      "color": "#f48221",
      "icon": {
        "default": "icon_transport_metro_u3",
        "indicator": "icon_transport_public_indicator"
      },
      "id": "metro_u3",
      "priority": "primary",
      "translation_key": "transportation_label.metro",
      "type": "public"
    },
    {
      "color": "#02a44f",
      "icon": {
        "default": "icon_transport_metro_u4",
        "indicator": "icon_transport_public_indicator"
      },
      "id": "metro_u4",
      "priority": "primary",
      "translation_key": "transportation_label.metro",
      "type": "public"
    },
    {
      "color": "#976a39",
      "icon": {
        "default": "icon_transport_metro_u6",
        "indicator": "icon_transport_public_indicator"
      },
      "id": "metro_u6",
      "priority": "primary",
      "translation_key": "transportation_label.metro",
      "type": "public"
    },
    {
      "color": "#3e466b",
      "icon": {
        "default": "icon_transport_unknown",
        "indicator": "icon_transport_public_indicator"
      },
      "id": "ship",
      "translation_key": "transportation_label.ship",
      "type": "public"
    },
    {
      "color": "#467da8",
      "icon": {
        "default": "icon_transport_tram",
        "indicator": "icon_transport_public_indicator"
      },
      "id": "tram",
      "translation_key": "transportation_label.tram",
      "type": "public"
    },
    {
      "color": "#a97e82",
      "icon": {
        "default": "icon_transport_tram",
        "indicator": "icon_transport_public_indicator"
      },
      "id": "innsbruck_1",
      "translation_key": "transportation_label.tram",
      "type": "public"
    },
    {
      "color": "#b44e69",
      "icon": {
        "default": "icon_transport_tram",
        "indicator": "icon_transport_public_indicator"
      },
      "id": "innsbruck_2",
      "translation_key": "transportation_label.tram",
      "type": "public"
    },
    {
      "color": "#9e545f",
      "icon": {
        "default": "icon_transport_tram",
        "indicator": "icon_transport_public_indicator"
      },
      "id": "innsbruck_3",
      "translation_key": "transportation_label.tram",
      "type": "public"
    },
    {
      "color": "#845165",
      "icon": {
        "default": "icon_transport_tram",
        "indicator": "icon_transport_public_indicator"
      },
      "id": "innsbruck_5",
      "translation_key": "transportation_label.tram",
      "type": "public"
    },
    {
      "color": "#006633",
      "icon": {
        "default": "icon_transport_tram",
        "indicator": "icon_transport_public_indicator"
      },
      "id": "innsbruck_6",
      "translation_key": "transportation_label.tram",
      "type": "public"
    },
    {
      "color": "#390412",
      "icon": {
        "default": "icon_transport_tram",
        "indicator": "icon_transport_public_indicator"
      },
      "id": "innsbruck_STB",
      "translation_key": "transportation_label.tram",
      "type": "public"
    },
    {
      "color": "#c4131a",
      "icon": {
        "default": "icon_transport_tram",
        "indicator": "icon_transport_public_indicator"
      },
      "id": "tram_vienna",
      "translation_key": "transportation_label.tram_vienna",
      "type": "public"
    },
    {
      "color": "#24c2f9",
      "icon": {
        "default": "icon_transport_bus",
        "indicator": "icon_transport_public_indicator"
      },
      "id": "bus",